[
    {
        "url": "https://notebook.drmaciver.com/",
        "name": "DRMacIver's Notebook",
        "feed": "https://notebook.drmaciver.com/feed.xml",
        "description": "Thoughts from David R. MacIver",
        "authors": [
            {
                "name": "David R. MacIver",
                "twitter": "DRMacIver"
            }
        ]
    },
    {
        "url": "https://ramble.rixx.de/",
        "name": "ramble.rixx.de",
        "feed": "https://ramble.rixx.de/feed.xml",
        "authors": [
            {
                "name": "Tobias Kunze",
                "twitter": "rixxtr",
                "url": "https://rixx.de",
                "email": "r@rixx.de"
            }
        ]
    },
    {
        "url": "https://notebook.lisamcnulty.co.uk/",
        "name": "Lisa's Notebook",
        "description": "Writing Exercises by Lisa McNulty",
        "feed": "https://notebook.lisamcnulty.co.uk/index.xml",
        "authors": [
            {
                "name": "Lisa McNulty"
            }
        ]
    }
]
